Id,Tweet,Hate,Fake
7757,sahi hai up bihar me itna sety hai ki delhi ka rasta yahi sy khulta hai but y vote ky time up bihar ky log apni ma bahen chudwa lyty hai,0,0
1750,corona ka kand karwane ke bad kejhriwal ji cm ho aap delhi ke jwab apko dena padega police aur modi ne nahi bola jamaat ke liye saad paise tum de rahe ho modi ji nahi,1,1
2792,tablighi jamat k piche rss bjp k mahan log lage hue qk unko lagta hai corona ka invention wahan se hua hai par un bewakuf logo ko yeh nhi dikhayi deta k ek saal ka masoom virus se ghatiya sarkar k ghatiya faisle ki wajh se shaheed hogaya,1,1
1092,jamaat jaahil chutiyaapa nahin karte hain to apna bharat azaad ho jta corona s,1,1
5532,ki note me nano gps chip wala akhand murkh bakree aaj economist bana he,1,0
6763,lagta hai mdm ne aaj ki indian news nhi dekhi morning ki kisne kisko mara uske bad bat krna sali terrorist ki beti bethi hui hai surpnakha,1,0
6812,kuch bhi,0,0
6537,bhagva love trap,0,0
2609,kaash ye jaahil tableeki jamaat k logon ne kanoon ka paalan kiya hota aur corona se jung me desh ki madad ki hoti inhone to kab ka sab kuch normal ho chuka hota hamare hindustan mein khair koi naibahut jald hum is ladaai me vijeta bankar niklenge bas supportlockdown,1,1
6560,are bahen tume garmi nhi hoti itna sab kuch pahenti ho wear sanatani sareee really looking awesome islam me ladkiyo ko sirf baccha banne ki machine mante hai or hindu me lakshmi durga maa kali ka roop mante jai maakali,1,0
2291,heheheabe bnd asli dukaandaari to tum logo ne kari hai bhai asli mudde se dhyaan hatakar tableegi jamaat aur hindumuslim indiapakistan hi khelte rehte ho tum log corona se desh ka majdoor marta hai to mare,1,1
1728,in bechare muslims ko furzi dhang se corona pidit bata rahe h in bechare pidit tablighi muslims aur unke guru maulana sand ko inke gharo me quarantine kiya jana chahiye,1,1
611,corona jamaat hai ye,1,1
4667,hum bhakt hi thik hai tum jaise fake media ke chamche to nahi kam se kam jawab to abhi tak nahi aaya khalistani naaron ka tumhara yograj singh khule aam hindu aurton ko rape karne ki batein kar raha tha wah kya farmer protest hai,1,1
344,ryt now china to corona virus mohabbat thi isliye jane diya zid hoti to bahon me hoti,0,1
7492,kya matlab vo fake account bi naveen lul haq ka he,0,1
6241,gajab betuki baten rehti hay in sabki,1,0
3751,inka dimag bahut tej chalta hai abhishek bhai ye ab khalistan keh kar farmers ke protest ko sikh hindu muslim me alag alag batna chahte hai aur kamjur karna chahte hai ye puri india ke farmers ka protest hai sikh hindu ya muslim ka nhi,1,1
5729,gps nano chip,0,0
6983,isse modi ke aahkeh kulti shayaadbrirani road pe laayibrpublic train pe laayi,1,0
3216,hamare desh mei ek bhi case nhi hota agar tera dhenchu pm rahul gandhi ki baat feb ko hi maan leta aur sabhi airport border seal kar deta lekin nhi dhenchu ko toh trump ke upar crore kharch karne thei usi,0,0
98,aise to china ki koi cheej nhi tikati hai but bc ye corona virus itne din se kaise tika hua hai,1,1
6556,sabse jhootha mazhab hai islam exmuslim ko sunne ke baad pata chala mujhe,1,0
1538,march ko order hua tha tab se march tak tum tak tabliki jamaat khali hee nahi karwa paye ya jaan much kar corona viruse faila rahe ho ke beej,1,1
3589,dange karna pulisonko talware se kaarna besabar ladki ko peetna lalkele par kabsa karke khalistan ka samartan karna yesab farmer protest hai rahul kidar gaya biryani khane,1,1
3649,aah jehre twitter te aake bonkde aa na v bhr baithe khalistan mangde aa farmer protest de naam te thode vrgi gandi soch kise di nhi honi kehsri rang khalisthani da nhi sikhi aa symbol aa te hor baki modimurderingfarmers,1,1
6368,shaitaan nhi bolte ki bache derai ho tb v taang uthado tumlog me toh behn akeli ho beti akeli ho toh tumhare abba pe hawas sawaar hojata h aur hm shaitaan h,1,0
4957,thanks bhai pathaan ka itna free promotion ke liyeab jawan aa rahi haind juneuska boycott start kardo,0,0
1518,pure hindustan mein theka sharab ki dukaanon per kahin tablighi jamaat ke log to nahin hai media ko ab nahin dikhega ki corona virus kaun faila raha hai,1,1
7639,bhashai bibad hai ye krur rawaeya thik nhidusre rajya bhi bihar me hai yahan athithi devo bhav ar sushasan me kanoon ka rajya hai,0,0
4625,abhi ye article padlo ab sab log bol rahein hain aap log fake farmer protest kar rahe hain,1,0
4273,is hadse ka jimnedaar ki sahi sabak sikhana hai,1,1
3670,tere dimag ch modi ne tatti kr di kyasmajh nhi aata tujhe ki farmers protest apne rights ke liye hkhalistan ke liye nhianpad aurat,1,0
2091,are they lesser than any tablighi as far corona is concerned,1,1
573,corona virus kidar start hua china mey yaa mecca mey bol jab ye log se lekar th date tak markaz ko gaye tho tab emergency declare nai kia govt ney aur international flights bhi ban nai hue tho inko kyun bla,0,0
7272,ye dalal patrakar hai talve chatna uska kaam hai patrakarita nahi,1,0
6063,bahan ji jinko islam pahle indian law baad me chahiye tha unke liye pakistan de diya hai please go pakistan jinko indian law pahle fir islam vo hi hindustan me rahe gajwa e hind nahi hone denge,0,0
6643,islam mera jhaat,1,0
3063,tablighi jamat vale log different country se corona lekar aaye the aur ye jo alag alag tirthsthan k figure hain wo to log darshan k liye gaye the like hamare muslim bhai bhi masjid jaya karte the th march tak so ye figure w,0,1
5075,kya se kya hogya boycottpathaan boycottbollywood,0,0
7852,maarne waale pakka suar jamaat ke hongeim chitra,1,1
5345,video kahin ka bhi ho bimari ek hai jiska chhota ilaaz yhi hai,0,0
5187,xyabass mere chitte ye hui na baat adhi adhi raat bhikh maangna chaalulagta hai jawan ke liye tayari suru kar di hai takle ne achhe se kariyo iss baar vi pathaan k cr hote hote bach jaega lekin jawaan ko k cr d,1,1
5358,hidenburg ko saat samundar paar adani dikha rha tha lekin apne hi ghar ka silicon valley bank aur signature bank nahi hindenburg svb signaturebank siliconvalleybank adani,1,0
4480,abdul hoga tera baap mera naam ek hindu bagawan pe he aur sacha hindu hu jo dusro ke fake news or nahi padta kagaz leke kya karenge jab pegasus covid mishap aur farmers protest tum logo ke ga mei bamboo gusad rahe hai tum lo,1,0
371,sahi kaha aapne brather china ne hi corona virus banaya hai aur vaccine bhi banaa liya haichina sabhi deshon ko tabah karke super power country banana chahta hai,0,1
1939,bhai main cheez to chhor di masjid me lockdown ke baad bhi jane wale log kyuki khuda pe jyada bharosa ho jae to akl ke andhe ho jate log to khoob masjid jao aur corona bhagao example tablighi,1,1
5665,bhai jis aadmi ne rs me nano gps chip dalke bataya tha uski reporting pe aap log bharosa kaise karlete ho yaar,0,0
6905,khud shetan shetan ki baat kar rahe,1,0
3671,abhi aap jwab do farmers protest ko khalistan se kio joda jata hai vha to sabhi dharmo ke log hai,0,0
3653,bhai hum farmer protest ki baat kr rahe hai na ki pakistan or khalistan ki in logo ke pass apna desh calane ki lo lale pade hai india me farmers ki kya help karege or khalistan kaha,1,0
2362,acha jamaati hein toh bakhi hindu hein toh corona failane ka zimah hinduon ne liya hai kya main saad ka support nahi karta jo masoom log jamaat ko jaake woh chahke corona nahi failate,0,0
4261,fake news failane k alawa kuch kaam nhi h,0,0
4991,sir kya aap daare the jab log pathaan ko boycott karne ko keh rahe the,0,0
7208,abe or kitna giroge hinduobrsala ab toh mujhe khud ko bhi hindu kehne pr sharm ati haibrinsaniyat barbad kr di hum hinduo ne,1,0
3738,in maam ko pakistan khalistan sab dikh raha hai bs nhi dikh rahe to farmers ke issues jiske liye woh protest ker rahe waise maam ne union to bata diye jo political parties se may be associated hai but maam banki unions to,1,1
4935,bhaisahab as a srkian hum salman khan k sath fanwar rok b lenge lekin ye chindi kumar k fans ne jan bujh k aryan khan ka mazak udaya tha jab woh jail mai tha pathaan ko boycott b kar rahe the ye log itni asani se maaf kar le inn,0,0
5522,aap ne bhi bina kisi saboot ke ke note me gps nano chip laga diya tha,0,1
6772,waah didi brnon muslim se shadi mat krro tum log door raho nahh conversion hoga nhh shadi tumbhi khush hmbhi,0,0
1172,babita madam agar itni hi sachi ho aur sach bol sakti ho to a bolo k corona ko india me laya kon tum jaise maldar naki tabligi jamaat,1,1
5214,boycottbollywoodcompletely boycottpathaan boycottbjp very well said kanhaiya lal on kesariya rang modi ne to release karvake blockbuster karva di pathaan matlab modi kesariya ka dushman hai wo saabit ho gaya hai,1,1
1423,tablighi jamati sab thumere muumy aur behan ka aashiq h sab jo unpr bolne prr ftt rha tha aur baap log ko ho rha h corona tho fadfdaa rhee ho bc,1,1
7210,to fir itni bhrantian kuon u tube jari hone deti hai lgam lgana jaroori hai kam se kam sal ki sja ka hi prawdhan agar ho jay to achchha ho kyunki public comment v to usi prasarit video par de deti hai,0,0
7921,ye manish kshyap ka vdo nehi ho saktakashyap ko fashena ka sajish,0,0
5260,tum logon ko to samjhana bhi bekar hai fir bhi sanrakshit word suna h suvar siyar usme nhi aate na samajh aaya ho to chapti dharti wali kitab padho,1,0
875,tablighi ke kya apne chacha hai kya unke baare zara bolo ithna agar corona keliya lad rahe ho tho,0,0
2298,himmat h to modi ji se sawal karke pucho jab desh me koi corona ka case nhi tha tab airport par screening shuru kr diye the toh corona aaya kaha se tablighi aaye kaha se dalaali karo bas tumse na ho payega,1,1
2644,corona ka ek achook upaay tabligi jamaat se abnoappealnorequest bheje mein sirf ek goli maaro corona se kabhi nahi hoga kasht aur jo bhi inke samarthan mein chhati peete unko bhi inhi ke saath ghaseete taaki sandesh jaaye spasht,1,1
6932,hazrat mai aapse baat krna chahta jroori hai,0,0
841,jab screening ho gayee tab kaise tablighi jamaat ke logo ke andar corona paya gaya,1,1
582,corona virus china ki chaal phle se antidot tha pass world economi kr dali khraab,0,1
205,corona virus nhi biological weapon hai china ne apne competitor ke vikash ke virodh me upyog kiya hai manvta ka hatyara hai china,1,1
1642,hain aur inka bhi corona test positive aata hai tab ye count hotai hain tabligi jamaat se phaile cases mei aai samajh aankh band karne se sach badal nahin jaata,0,0
2015,tableghi jamaat k logo ne kiya apna plasma donate kaha insaniyat k liye apne khoon ka akhri katra bhi de dege iss par bhakto ki jali g kaha corona se g marwa lege lekin antidot ka istemal nahi krege,1,1
3254,par uske bad who itna bole testing karne ko bhai testing to badhai nehi aaj tak testing rate kam he hai as compared to other developed country fir rd pe hai sirf tablighi ke liye bhai yaha tu,0,0
7240,pakada gaya ki nhi vo,0,0
906,mulk se mohabbat to khoon me hai saheb azadi me bhi diya tha or corona me bhi de rahe hai tablighijamat,1,1
632,ye corona sirf tablighi jamaat walon se phelta hai covid,1,1
5679,madam aap wahi hain nah jinohone rs ke currency note pe nano gps chip ka khoj kiya tha,0,0
5138,pathaan movie aisi hai ki jisne iska boycott kiya woh bhi dekha aor iski lokpriyata har din badh rhi hai bahut hi mast movie hai pathaan crores worldwide,0,0
1975,jis jahil tablig jamaat ke logo ne desh me corona failaya unke khilaf ipc aur ipc ke tahat mukdma chalna chahiye aur deshdroh ka bhi mukadma chalna chahiye koun koun sahmat hai bhai,1,1
163,teachlessontochina chinaindiafaceoff china chinese itne maar gaye hai ki bata bhi na parahe hai corona virus saale,0,0
5465,sir ji adani ki toh koi legal report aayi nahi fir bhi aapne bola ki hindenburg ki report sahi hai hypocrisy ki bhi seema hoti haikabhi toh khud legal notice ki baat karte ho kabhi khud hi use f,1,0
7185,jai shree ram,0,0
5096,pathaan kya huva chumtiye bhot boycott kar rha tha subh shaam,1,0
4714,dilli walo ne khud to kanjar sarkar ko chuna hai pehle shaheen bagh ko support karne khud pahuncha ab fake farmer protest me bhi unke saath hai,1,1
876,corona virus entered india chalo tablighi jamat karte hain chalo shaheen baug khali nahi karte hain,1,1
1432,hoga jarur hoga abhi tak tablighi jamaat ke sabhi members ke logo ko corona positive hi aaya sadhu santo ko nhi suna abhi tak,1,1
4644,shame on you there s farmers who s son recently died in army kis mitti ke bane ho tum log fake protest me log apni jaan nahi dete itni sardi barish me sadko par baithte nahi tum paise leke yeh sab karte hoge woh apne haq k,1,0
7854,sir hum log hue hain,0,0
5002,poi pathaan boycott cheeyu chaanakame,1,0
7382,shameful sad,0,0
2857,agar jamaati corona virus felate to ek bhi musalman nhi bachta na jamaati jisme virus na ho maharastra kiya vaha bhi tabligi jamaat be felaya gujraat me tabligi jmaat,1,1
1862,in tamilnadu case tablighi hai kya ye report b galat hai sahi bath and tho ye hai miyan tablighi jihadi k karan desh me corona teji se badh gaya hai modi fobia get well soon,1,1
2660,waha konsi jamaat ya musalmaan lekar gayehamare yanha majdur ghar ja rahe the paidal bhuk se mar rahe the docter logon ke paas jaruri equipments nahi they log corona ke bawajud namaste trum kyu karwaya gaya pm se swaal kar rahe they to in sab baaton se dhyan bhatkane,0,0
3385,jath sharam ki waje se hi shaheen bagh huva delhi riot huva usko karne wala politician kon si party ka tha power ke liye ye bilkul psycho ho chuka hai pehle kuch kaam sahi me kar jhooti b,1,0
7341,shame on bjp rapist kahi ke braur do bjp ko votes dekhte dekhte te poora desh apni yaar ambani ko bech dega,1,1
7657,tamil nadu me sirf rakshas rahte hai waha ke logo hindi bolna bhi nahi jaise ye log bharat se nahi ho dub ke mar jana chahiye,1,1
5297,modihaitomumkinhai modiadanibhaibhai adanisolidcomeback adanihindenburg adaniscam baar vote jo diya hai abhi nota,0,0
4734,kya hai tu farmers protests kr rhe hai tu covid ko roo rha jo hai bhi nhi fake report dene vllo kisaanmazdoorektazindabaad kisaanvirodhinarendramodi ripmodi,1,0
3332,shaheen bagh ke dance ka video share kr ek baar,0,0
6543,allah hu akbar,0,0
6021,pyare behen tumhe sanatan dharme me wapas aane ka invitation rahatumko azadi re rahne ka mouka milega pengun banke ghumne nahi parengeaacha hindu larka dekhke tumari sadhi bhi karwa denge,0,0
7823,ground reporting kijiye tamilnadu jake sb yha bethe bethe bhok rhe ho tamilnadu khud jake koi dekho ek bar,0,1
2097,arey tum bhakt nahi andhbhakt ho jamaat se atankwadi bhakt ka compare kidhar bhai bhakt hi sabse bada virus hai corona ka treatment hai par atankwadi bhakt ka nahi,1,0
2004,wah re akhri chingari jaldi bhuj jaoge peacefully corona yaad hai desh ko maut k mooh may kisne bheja tablighi mulle dr pay kisne thuka bhool gaye sadhu ko maar diye sharam ho toh pi lo or mar jao,1,1
6588,hindu jisna apna naam bdl krr abdul rkha or muslim ladki sa pyarr kiya or uska tukra kiya brbhagwa love trap andhnamazi,1,0
547,corona virus koai natural nhi hai china ne spraid kra hai,0,1
1450,abhi tak koi patrakaar corona marij nahin hua ems mein dava nahin hai narson ke liye safety tik nahin hai yah chali hai jamaat me corona nikalna,1,1
5549,aur aapne hazar ki note me gps technology aur nano chip ka zikr kitni baar kiya tha hadd ho gai ye news hai bhala,0,0
2611,nizamuddin me log the tablewgi jamaat aur corona ke jimmedar puri muslim kom ab jo dari baj kal se kar rahe hai wo ko,1,1
1901,arey ye aap kya bol gaye anjana ji corona to tablighi jamat ne pehlaya poori duniya may ye baat saari bikav media jaanti hai aap be wajah china aur cheen ko badnaam na kare is baat ke liye,1,1
6305,kam se kam hindu kaat ke marte to nahi hai muslim ladko ki tarahbrbrproudly saying i am hindu,1,0
2758,chitri hi thi jo jamaat pe zhuta ilzam lagai thi k bus me se thuk rahe hai corona warriors ki duhai aur diwani ban baithi thi ab uska jigar mar gaya ab nahi dikhrahi warriors ki pareshani kaleja hi nahi k yogi sa,1,1
1886,jab aage aana chaiye tha corona k oppose me tab to tablighi jamaat k log chup kar baithe the na tab samne aate to may be respect raheti unke bareme,1,1
7724,tamil log tamilnadu se bahar nhi aayenge kya,1,1
2098,tunay puray desh main apni deshbhakti say nhi nafrat aur faeinafwah baato say desh ka aman chain khrhab kar diya sharam aani chyie corona faila diya tablighi ki tarah tu bhi deshdrohi h,1,1
7626,umar ho gyi hay na beta baithne ki adat hay,0,0
7184,is being muslim in india is crimebrbjp ne sb ko barbad kr dia hai,1,0
837,bo tabligi jamaat wale teri maan ke yaar they jinhone corona ko failaya,1,1
3472,jinhone diya tha mustafabad walo ne unka kya kaam kiya aapne jab waha dange hue to kejriwal ka kya role tha waha okhla ne vote diya to shaheen bagh protest pr kya bola tha kejriwal ne,1,0
4698,fake farmers protest ke aaj ka langar menu kya hai justasking,1,1
6365,ye sab doglapan hai,0,0
2172,padh liya karo pehle yaar jab jamaat chal raha thha tab ajay bisht ne kaha thha ki hum ram navami karenge corona se ram bachenge baad mein cancel kiya thora dimaag lagao yaar,1,1
6876,kya haisaitan saitan saitan bacho bali baat,0,0
6811,ooyy didi television haram h islam m,0,0
399,china ki koi bhi cheez din se zyada tikti nahi hai ye corona virus kaise tik gaya coronamemes covidoutbreak,0,1
2011,pehle kanika kapoor fr tabligi jamaat ko kasoorvaar bolne valo abb yeh sharbiyio ki sab se ghtyiaa jamaat ko kya khaogeinka koi hakk ni bnta ki govrnmnt inka corona se illaaj kre lahhnaat ha en pr,0,0
7677,odisha ka amara village ka logo bi mar kaye te,0,1
1284,sahi baat bhai tabhi delhi me marij kam ho rahe hai agar ye jamaat wale khud samne aa jaye to jaldi hi delhi corona free ho jay gi,1,1
6013,islam sirf ek pagalpan hbrye halala mutaha saadi randibaaji ye sab kya h islam k,1,0
5850,nano gps chip,0,0
4257,pakada gaya ki nhi vo,0,0
1837,abe gaandu ye sacchi he ki abhi india me jo corona ke case bad rahe he wo tabligi jamaat ke kutto ke karan hi bad har baar tum apni jaat dikha dete ho,1,1
1020,tablighi jamaat wale corona terrorist hain kashmir main terrorist ke saath kya karte hain wo hi inke saath hona chahiye,1,1
1327,sahi kahamaharstra aur delhi to jamatiyo ke hawale haiwaha corona free karna kisko hai jahil jihadi jamaat ke jamure,1,1
5930,iski shakal admi jesi lag rh h fake admi h yeh,1,0
476,corona virus china se bana hai ye human made virus hai jisko china ne sirf apna dabdaba banane k liye kiya taki dusre deshi ki economy kharab ho jaye or china sabse upar rahe,0,1
2811,kon sa right wrong din raat hindu muslim karti hai chudel jab tak jammat nahi tha corona china se aaya tha jaise hi jamaat aaya corona hindu muslim ho gya ye dalali or gatiya soch apbe paass rakho mujhe batane ki zarurat nahi or,0,0
6010,propaganda brarrey bhai aap ne khud kah diya ki non believers islaam ko kabool karke aaye brmatlab aap pakki secular hai hai baaki sab intolerant,0,0
1652,jummah namaaz ki jamaat main eik corona virus ka patient khaanstay hoye dua maangta hai ke ay allah pakistan ko iss azaab se nikaal day wah bhai wah jahalat zindabad,1,1
7419,good work delhi police,0,0
6837,teri gand me dam hai to exmuslim ke pass jake debate kar,1,0
2529,jo samachar hame news channels me milna chahiye jaise medical kits migrant labours jobs planning for future etc but milta kya haiwahi pakistan haar gaya corona muslim corona tabligi jamaat aur kuch channels me mujra v hota hai,1,1
1207,safari tablighi jamaat ka thuk shamil hai corona failane mein akele china ki hissedari thodi na hai corona failane mein,1,1
5205,boycottpathaan trend bada bhadiya tha,1,1
7086,majority of hindu bjp ko vote bhi yhi propaganda k lia deta h,0,0
6157,abe chup ho ja satvi fel,1,0
5050,dear andhbhakto se anurodh hai ke ab wo pathaan ko chhod jawan ko boycott kare,1,0
868,reason bhi bata bhai k trump ki jamaat bulane k kaaran yaha corona faila,1,1
2975,khud ke harami mc jamaat wale bhadve corona boom le kar chupte ghumre majid me chupre sale terrorist kahi ke khud ka dekho bad me pata chele death rate me jayadaa tr muslman ho fir bolna jamaat wale jindabad hindu doctor,1,1
542,desh washio corona virus se mat maro bach kar raho marna hi h to china se lar kar maro jindgi desh ke kam me aayegi,1,0
1133,aa gaya ola hu uber chillate hue tablighi corona saale paper dikha nahi to pakistan jaa,1,1
7806,modi aur yogi kuch tho bolsirf bhasan chodne se kuch nahi hone wala,0,1
7932,ka karykarta hai jo pahla bjp ka kataar supporter tha,0,0
3391,ed cbi ke baad nia ki bhi entry ho gayi hai kyunki naxals ko funding karne ka bhi mamla saamne aa raha hai jab delhi danga aur shaheen bagh mein funding hone ka shaq hai ab kaun aata hai aur kaun jata hai ab janch se pata chal jayega lakin kumar vishwas kabhi hawa mein baat nahin,0,1
5756,ek baar imaandaar patrakar me apna naam aur ravish kumar ke naam par bhi ek voting karwa lo sir aukaat pata chal jayegi nano gps chip mil jayega ke note ki tarah,1,0
2963,auqaat auqaat ki baat hai padhe likhe aur advance log lab me experiment kar rahe hain science ko le kar aur jaahil gobar aur mutra me corona ka ilaaj khoj rahe hain duniya bhar ke padhe likhe desh china ko zimme,1,1
4156,se leke aaj tak ne b kuch aisa hi kiya h shayad hindus hindusunderattackinuk hindusunderattackinindia hindusunderattack hindulivesmatters waqfloot waqfact ramsetu,0,0
3260,pahele apni jaat walo ka hisab do tabligi jamaat walo kaunhone kitna corona virus ko failaya or kyo failaya kise majid madarso ne gareebo ki help ke liye hath ba,1,1
5199,bilkul waise hi boycott karna jaisa pathaan ka kiya tha,1,1
7893,chor our dalal godi media se our kya ummid ki ja sakti hai har election ke pehle aisa karna in logon ne apna dhanda bana liya hai take sahab our unki toli khush ho,1,0
2584,agar desh bachana hai to en jamat walo ko pakdne ki soacho na ki debet karne ki duniya corona ko rokne ke liye kaanoon banaya par yahan sab pata hone k bawjood v jamaat walo pe koi action nahi agar ab enko seedha ni kiya to bahot der ho sakti hai enpe nsa laga k jail askzee,1,1
2814,ye log chup chap ilaz krwa lenge tablighi jamaat wale doctors ko hi lynch kr de rhe the susu potty thook thak ke corona spread kr rhe the tablighi ki hi den hai aaj pura desh doomed ho chuka hai bhot kuch yaad hai faltu ki jhadu poc,1,1
6209,ye pagal aurat ulti ganga baharahi hai,1,0
6933,hazrat lakh tadad sahi hai mera riserch hai androoni,0,0
7714,mein pure bihar vasiyon se nivedan karta hun ki ek jung shuru kijiye aur aukat dikha dijiye tamilnadu ko up bihar jharkhand mein kam log nahin hai se karod janata hai,1,1
3587,khalistan zindabad ho raha hai ye dekho farmers protest b to ho raha hai sari dunya mai india ki hogai gau,0,0
6872,kis shetan se ye baat kr rhi h yebrbrmuslim khud ka hi dushman h brbrisis br to,1,0
5240,kaise laan chatne ki race lagi hai chamchon aur chutyon mein,1,0
7996,abhe chutiye bad rahi toh nakli note bhi koi chap raha hai deshwasi se anurodh hai ki s s s rupey me hi bank se withdraw kare nakli note nikal ke mat layei bacho ka gala na kate,1,1
2631,jaisa ke hum sabhi ko pata hai ke pura vishwa corona virus me khatre se joogh raha hai hamara desh bharat bhi iss mahamari se joogh rha hai pichle kuch dino se tablighi jamaat ke kuch logon mai corona sankraman ki pushti ke baad bharatiye media iss tarah se is khabar ko chala,1,1
6407,in behrupiyon ke chakkar main na aayen ye sirf baate hi mithi mitthi karte hainbrkab bomb ford denge ar gala kat denge apko pata nahi chalega kuch akhbaro main choge phir ghumnam ho jaoge,1,0
7274,yeh sanghi saale pagal hogaye hai kuch bhi bolrain,1,0
1081,corona failane wali gang tablighi jamaat se bhi zyada khatarnaak corona failane waali gang zeenews zeenewssealkaro,1,1
4284,yah kaun sa jihad hai sudheer chaudhari se janna chahta hun chatu patrakaar jawab jarur den jisne patari per cylinder fenka uska naam gangaram hai,1,0
2086,jahil e jamaat ki wajah se corona teji se fail raha hai in bhadwo ko hamare desh se koi matlab nahi ye corona jihad faila rahe hain inlogo ko goli marne ka order diya jana chahiyepahle us maulana ko goli maro,1,1
2453,lagta hai jyada bhai bahn the tum log ghar me tel malish hue n hogi ab zee news kharab trump kaharb lekin tablighi jamat jo ki corona failane ke bad chhupe bhi kewal wahi nahi kharab kaha se late hai itn,1,1
4967,one more gobar bhakt amp boycott chintoo spotted teri tu gaand phat gayi pathaan ka collection dekh kar abey kuch tu sharam kar crore,0,0
2024,malaysia mein bhi inhi tablighi jamaat ne corona virus phelaya hai toh jo apne aap ko hindustani ki manta hai darr kyun raha yeh bolne se ya toh manta nahin apne ko hindustani chor ki daari mein tinka,1,1
6038,mast joke maara re br,0,0
6697,musalman khud khudke dushman hai hai sanatani,0,0
227,bhaicorona virus ka vaccine bhi china se hee aanay wala hai,0,1
1014,pura jamaat ne aag laga di corona faila ke chalo koi nahi chakkar lagate hain,1,1
1930,jo log yakub menon ko terrorist nahi mante the wo log aaj rss ko terrorist bol rahe he kya dogla panti he ye salam aap sabko jamaat ne corona aur islamophobia felane me bahot sahi kam kiya he,1,1
5649,please nano gps chip modi full confidently,0,0
1405,maulana saad mauto ka zimmedar hai or desh ke arbo rupee ke nuksan katablighi bamb ne pure desh me corona failiya hai,1,1
2180,dard to janab upr wale ki trf se aaya hai or poori duniya pr aaya hai sirf jimmedar hm logo ko bna diya gya hai tablighi jamaat bolkr or inshallah corona harega hindustan jitegaom lockdown ke douran tablighi jamaat ko pura kiya gaya ye state government ki diye gaye chhoot ke wajah se corona mahamari teji se apne pao pasar rahi hai,1,0
698,haan wo corona jamaat walon ke liye hai,1,1
1125,aur pure desh me corona failake kitne logo ko mar diya tablighi jamaat valo ne is par bhi ak report upload kar do,1,1
3896,aaj hame hamere bhagwan ke darshan mila jay shree ram jay bhim jay hind hindurashtra hindusunderattack dalithindu dalit sanatanadharma hindutva hindurashtra hinduism hindumunnani,0,0
1779,yahi dost modi ko corona ki vaccine dega jara jamaat walo k baare m bhi btaa do maam jiwo bechare aapke ek tweet k liye taras gaye h inke saath bhedbhaav kaisa,1,1
5111,haan aur karo boycott pathaan toh blockbuster ho gayiab jawaan ki baari hai,0,0
