Id,Tweet,Hate,Fake
1763,dinesh ji aap tab kha the jab jamaat ke log corona faila rahe the ab apko chinta ho rahi hai bhai rahul ganghi ki trah tum bhi chalu ho gaye kuch to sharm karo,1,1
751,corona spreader md shaad aur thukne wali jamaat abhi bhi farar hai,1,1
1786,kal fir se jamaat walon ne bandra station pe bheed ikaththa karke ke corona virus failane ki koshish ki,1,1
6654,agar apka religion sahi h to usko convert kyu kdvana ko bolta h hr jagah hr baat pr,0,0
6213,sala islam v izzat dene ki cheez hai mujhe to avi pta chala,1,0
4502,bina proof ke koi v bat nhi kr skte farmer protest kise ek ka nhi hai sbhi ka sanjha hai es mai koi dhrm ya jata pta nhi na koi valmik na koi hindu or na koi other ye fake news kaha se le,1,0
4854,abee tu wahi hai na jo ruppe me boycott krta dolta tha tumhara toh antim sanskar krdiya pathaan,1,0
2712,tabligi jamaat ko band kar do bharat mai aur sakht se sakht karya vahi ho tabligi yo pe kyu ki bharat ko corona tabligi yo ne hi baata hai gunaah ki sajaa to milni hi chahiye aur tabligi jamaat bharat ke khilaaf bol rahe hai aur kam kar rahe hai kuch hona chahiye inn logo ka,1,1
6469,shaitaan aka dadu khalu etc etc jo ghar me hee kabhi chut par hath marta hai to kabhi sine pe,1,0
4194,kaha h sab librandu and inki fauj kaha h kaha h muslim ki chachi tum jahilo ka kya khana h isper hindulivesmatters hindusunderattack hindus,1,0
1334,ab ye kahna hai aye corona ab to aaram de kya chah rha jamaat ko goli maar de,1,1
7122,kuch bi,0,0
2855,achha tumhe iss baat se problem hai kya k tablighi corona failaa rahe the har jagah thook rahe the khaana fek rahe the doctors nd police ko insult kar rahe the but tumhare hisab se sahi kar rahe theaur media ne ye sab na,1,1
187,no mention of corona virus china ke is julam ko yaad rakhenge,0,1
1137,jab unko corona jihadi kahna tha tab wo tabligi the ab plasma donate kr rhe to unhe tablighi n kaha jaye ghatiyasoch,1,1
2059,ab jamaati blood de rahe he to dalaal media ko nahi dikh raha he corona bahut jalldi dikh gaya tha sache desh bhakt to jamaat bale huye na ki dalal media media ko mafee magana chahiye jitana jamat balo ko badanaam kiya,0,0
7513,kyu mango man naveen aa gya swad ab panga lega apne baap se,1,0
6704,or tumahra allha baccho ko pregnant karne bala,1,0
149,in salo ko pta ni hai ki china k kitne mare kyuki jb china ne itni bdi mahamari corona ko chhupa liya to kya ye sainik k mrne ko ni chhupa skte chamche akhir chamche hi rahenge ab ye bhi kh dena ki corona virus bharat ne failaya hai,1,1
4125,vivah toot gayi aur kayamat ho gayi kainaat ki hindusunderattack,0,0
4890,arey yaar kaha the kuch din se gayab he the arey yaar aao raho thoda maza aata hai boycott walo kaise lagi mara ke pathaan to hit ho gaye muh to mat chhupaao,0,0
6481,saitan mohammad,1,0
3364,sahab shaheen bagh ki koi gali aisi nhi jo sahi ho main road pe poore poore nale khule pade hai sahab bas facebook pe lage hote hai sekdo msgs ke baad koi reply nhi isliye ab aapko bhi bata dete hai shayad aap koi action lo din me,0,0
4789,jawan ke boycott ki taiyaari dhang se karna pathaan to atbb ho gyi,0,0
2867,kya logic hai logon ke plasma donate karne se baaki hazaaro se faile corona ko bhul jaye india ke kitne states me kitne logon me corona failaya zara yeh aakda bhi batao na woh jamaat ka head kyu chupa,1,1
3777,yehi toh baat hai yahan farmer protest ki baat honi chahiye law mey kya galat hai aur kaise isme sudhaar kiya ja sakta hai ismey baat honi chahiye but u see urself twitter par hi kitne sarey khalistan,0,0
1387,jamaat k virussharm kijye aplogcorona ka ilaaj insha allah zaroor mil jayega par aaplogo k man ka communal virus ka kuch keh nahi skte,0,0
5942,alhamdulillah masha allah bhut acxhi bat,0,1
7552,ke liye koi mudda nhi mil raha hai hawa tite hai inki,0,0
6619,ye kis university se padh kar aayi he murder kon kar rha he isse bataao setaan kon he,0,0
5696,bhai zeenews ka wo ki note me nano gps chip vala sach actual me mil jaye to batana baki aap wahi dekhana waha pe desh ko batne ki achhi bate hoti he andhbhakt,0,0
3630,kya bekar rs aurat hai yaar apni country ko paise k liye khushi khushi khalistan ko bech rhi hai innocent farmers k aad me ye protest anadata ne kiya ye tractor parade sukh rakhne wali thi besharam insan hai shi me tu,1,0
7196,aj se bjp waya har chij me hindu muslim,0,0
4798,pathaan ne aisi gaamnd maari boycott gang ki ki aawaz bhi nhi nikal rhi thi mooh se,0,0
3029,lockdown ka paalan sirf hindu kare desh ke liye hamne saare teej tyohar chor diye hum navratra me daily mandir jaate the mushalmano me corona nahi hotakya markaji jamaat ka ghaav bhara nahi ramjaan kaand shuru aise to bhul jao ish desh se corona khatm hoga,1,1
2970,corona ki chetawani who ne january ko de di thi fie kyu trump ko invite kiya or jab trump yahan aaya tha to america mein corona ka case saamne aa chuka tha or fir ahmdabaad or agra mein kyu mareez z,0,1
6958,asa logo ko muma gas ka pip dalka gas chudna chaia,1,0
1709,kapde utarkar ashleel harkate karna aur jamaat se corona failana yahi sab to kiya h nail me daalna chahiye usko,1,1
2954,mazra yahi h ki tablighi jamaat ki maa ki chut hai aur tere jaise desh ke gaddaro ki bhi jamati madarchod ne pure desh mein corona spread kiya tera mulla saad aur sare jamati suar ki maut marenge apne imam,1,1
455,secular shahid bhai free mei nhi de raha india ne rd march ko china ko masks bheje the aur modi ka virodh karo theek hai par kya ab jis country ne corona virus failaya usko support kar rahe ho,0,1
6137,porn bedsits se achha quran hai padh ke thada ho jata h,1,0
6691,ik baar qran search kar ke padh lo orr phir hadees padh lo phir decide karo kya inme jo likha hai yaa karne ko kaha jaa raha hai vo thik hai brtoh next step lena brkisii ladki yaa ladka yaa soo cold love jo month hai ossme mat lgg kar dharam badl lena,0,0
610,jamaat hai to corona mumkin hai,1,1
4264,congress ka haath,1,1
4827,pathaan boycott ka kya hua sadakchaap,0,0
6785,aapke jaisi nahi hai jahil sanatani aur dhokebaaj dhoka deke to aap paida hote ho abu mamu bro sis sabke sath agar hinduo ne love prem kiya to kuch hi salo ne islam bharat se mit jayega par aap jaisi gandi ladkiyon ki snatan me jarurat nahi hai malech hi rahegi gadarter ki faidaish,1,0
2075,till ka taad tablighi jamat ka corona casebhi aisa hi kuch kiya tha bjp govt jab aap bhi bahut zor shor se hisaab le rahe the isliye aap to rehne hi do rajat ji aapse na ho payega,1,1
4053,dekh lo hindu ye haal hoga apna raksha krna sikh lo aur jo libral gandu banta hai bhenchod ab chup kyu aur aur sala ye sb kabhi trust ke layak nhi hota hai bhai gaddar hota hai madharchod blood me hee sala mulla hindusunderattack,1,1
6505,last line islam me convert ho ki aproch kare gi ghur ki ledi ho,0,0
1623,airports par corona ki screening nahi hui isi liye coronavirus india mai aya aur phil gaya airport ki nakami ko tablighi jamat ke oopar transfer kiya ja raha hai,1,1
4684,shaheen bagh v ke dange protest jaldi khatam hone chahiye fake farmers logo ke,1,1
5498,abe adani ko dekh le aur apne ko dekh le soros ke paid agent teri boli to sc ne hi re lagai hai tera kitna money hai be gaddar tere jaison ko to adani jahdoo maarne ka kaam na de bada aaya our money bolne wala chal account b,1,1
5797,bagdadi ke bahane sweta singh ke naam pe ek meme toh banta hi hai warna ke note ki nano gps chip bura maan jaayegi,0,0
7431,new india guys mother of democracy,0,0
41,besharam imran ek biwi sambhati nai ab tak teen nikah kar chuka hai tu apne baap china ko kyu nai puchta usne hi banaya corona virus germany se india ki dosti kitni purani teko batata,1,1
5476,bewajah ki ameero ko hate karna aadat ban gayi h jalankhoro ki abhi tak hindenburg report ki ek bhi cheez sahi saabit nhi hui kis baat pe adani ko hate kar rhe ho ye to batao konsa rahul gandhi ki tarah bina kisi business,1,0
2090,markaz ko jab corona ke liye badnaam kiya gaya to guas o khwaja ke chahne walo ne bhi iska virodh kiya firr ab jab gareeb nawaz par ungli uthayi gai to kitne jamaat walo ne aawaz uthai sawal kyu na karu mai,1,1
3925,kya hindu aur unke mandir desh ki rajdhani mein bhi surakshit nahi jabki police aapki hai hindusunderattack,1,1
2176,pahle tablighi jamaat ko chupa k rekha phir desh mein corona falaya phir sarkar k daulat katam kar diya plasma therapy nizamuddin markaz k maulana saad k farm house chal rahe h kya janata ko sab pata h issliye chup raho,1,1
75,innocent animal hatya ki sazaa china bhugta raha hai pangolin bat animal hatya ke kaaran corona virus nikala ishliye bakri hatya se dubara virus na nikale ishliye animal hatya mukt eco friendly bakkridd,0,1
6404,ye burka isiliye pehante hai ki andar kaand kare chehra na dikhe dikhe sirf saman,1,0
7884,kaha gaya ek bihari pe bhari,1,1
2658,kejriwal wo kirda hai jo saheen bagh paida kiya tha fir delhi mey hindu musalman ko lardaya fir tablighee jamaat ko corona bomb tair kar ke desh mey chorda fir delhi ke labour ko up hariyana mey dhakel diya aur ab roz tv apna,1,1
3181,aapka bahut bahut dhanyavaad kamsekam aap maane to bhai tana nhi maar rahe hai jab kahete hai ki jamaat ko ye nhi karna chahiye to bolte hai corona ke karan log namaaj chhod de hm unko suna rahe hai aur jo log d,0,0
2077,haa ghr pr aaraam se kha pee skenge lekin kuch logo k liye to train bus nhi chlayi ja skti na uske vjh se bht sari bheed ho jayegi fr dobara jamaat ki trh corona virus or speed se failega,1,1
442,that is what my question is december me china me corona virus paya gaya apne desh ke zimmedar log kyu ye faltu visas ko banned nahi kare thode mahino ke liye visit aur tourism visa par ban,0,1
2052,vo bhi gazab ka aalam tha jab sharab ka dukan khula thajamaati toh the lekin sharabi toh lakho me the bade bhaijamaat aur jaat ko chodo aur saath me milke corona se lado,1,1
2542,mujhe laga tu hoshiyar hoga chalo modi ne laya corona par modi sabke samne he aur logo ko ghar me rehne kaha he logo ka acha soch rahe he par tablighi ka atankvadi kyo chupa he jiski galti nahi to kyo chupa he bahar kyo nahi,1,1
1302,khaki chadi aa geya bahar khujliwal ka h ko tablighi jamat itna problem tha jagnath ji rath yatra me corona nahi badhe ga islamophobia,1,1
7354,yaar ab kyu koyi aage ake nahi bolta ya tabhi bolte hai jab ye jeet ya haar kar aate hai,0,1
3431,yeh dekh protest pe baithe hinduon pe lathi charge shaheen bagh me kyu nahi farmer protest me kyu nahi wo to aag bhi laga rahe the protest ke naam pe,1,0
1305,senate me corona ki soratehal par behas opposition ki hukomat par tanqeed sindh me pehli ta wen jamaat k talaba ko promote karne ka faisla,1,1
237,modi ji atamnirbhar baniye kunal kamra we support you china thank you for the corona virus chtiya hai tha rahega,0,0
6670,hakik majahab hai teen land lena,1,0
2600,ager delhi police ne permission di bhi to sabse jada corona cases to tablighi jamatiyun ke hi nikal kar aa rahe hai upar se dr police par patthar mar rahe hai hume to sharm ati hai tujhe jaise indian hone par ki tune aaj tak jamatiyun ke khi,1,1
4617,propoganda chalana ho toh ye bhi sahi uparse fake farmers protest bhi karne aayenge,1,1
2574,doc ap to har cheez court me prove karte hai proof hai in baton ka court ne to kuch aur hi bol dia unke liye tablighi jamaat wale corona faila rhe the but mandir me jo bheed lagi wo corona bhagane ke liye thi right htt,1,1
3281,are respond kyun karta hai maza loot har gaya hai senapati fekuchand ab uski sena bahanebazi karegi mazze le ab co gress ko gali nahi de sakte corona nehru ke samay tha nahi to bacha k,0,0
3187,technology itni aage nikal gayi hai ki china biological weapon cronavirus bana raha hai or tumlog aaj bhi molana se muslim dhram hi sikh rahe ho dheko kya kiya ja,1,1
3954,pathan ko youtube par daal do sab dekhenege hamare khujliwal khush ho jayenge warna boycottpathanmovie boycottpathan boycottbollywoodforever boycottbollywood will continuegaddaron aur deshdrohiyon ki movie pe paisa kyun kharch,1,0
2769,aaj tak channel walo ne jamaat ke na pura musalmaan koum ko corona carrier sabit kar diya jo aaj musalmaan jagah jagah lanchan khaa rahi hai kahi maar khaa rahi hai agar kisi din firse nyay tantra isthapit huwa nyay ki kathghare mai khar,1,1
4832,abe chumtiya tumlog se kuchh nhi ho payega social media pe hi gyaan peloge boycott gang ka aukaat dikh gya pathaan moot ke chala gya tum logo ke thopdo pe,0,0
4224,dont be blind narendramodi enough is enoughkannoon ghanta khuch nhi kar payegahinduo ko hee jihadiorakshasoheaveano bhediyose swayam ki raksha k liye khuch karna pdega hindusunderattack islamicterrorisminindia pmo,1,1
2107,are mere bhaiii tablighi jamat ke program me dusre desho se lok aaye thetemple me dusre desho se log nhi aaye theeaur ye corona bahar se hi aaya hai na ki iss desh me paida hualogic lagao yar thoda,1,1
2680,haa ya mai bi defence me hu jamaat ke mukhiya kiek baat sonch agar tabliqi jamaat ke mukhiya ko corona phelana hota india me tu abi tak kitne cases hotey aur plasma kyu donate karte agar phelana hota tu media bas muslims ko target kar rahi hai aur mujhe aur koi baat nahi karni,0,0
2762,ap ko to zada he pata hai media par mat jio apne ap par jio dusro par tohmat mat lagao plz pure world mein jo corona various faila hai kya weha bhe zamat yah tablighi zamat nae falaya hai india sai pahale to yah bimari aur mulko main the yah,1,1
4689,kisaan khet par hote hainaki border per ye jo protest ker rahe ye tho pakka hamare hindustani kisaan tho hai hi nahi we respect our true hardworking farmersnot these fake biryani wale kisaan lol il naya naya kisaan bana hai tu fake farmers,1,1
5400,ache din aagaya adanihindenburg adanifiles gautamdasmodani lpgcylinderprice gasprice stockmarketindia,0,0
1388,bhagwaan aap ki maa aur sabhi maa o ko lambi umr de par suna hai desh me corona jamaati faila rahe hai waise ye kaunsi jamaat se ho aap log,1,1
7504,karma ne kya jawab diya hai naveen ko isny kholi ka majak banaya jab kohli ne mara tha tab bhi rcb nahi win kar payi meanwhile his team all out on brthats called revenge of karma,1,0
7239,khon hi kharab hai inn madrachodo ka gaatiya kitabe padhte hai toh gaatiya haartaak hi kaatenge na,1,1
6434,ap halala karo yahi mazhub hai,1,0
6887,bole ka pehle aazadi mile to,0,0
7708,tamil bale randike bachha sabbrbrham bihari chah lenge to tamilnaduu saf kear denge,1,1
5001,dekho dekho tumhari mantri ne apni bitiya ki shadi mein pathaan ku bulaya hai kia abb ka boycott trend chaloge,1,0
5854,tum chhee news dekhte ho wahi manogejisne k note me nano gps chip lgayi ti aur music system aur aaj tak uske liye maafi nhi maangi tihaari ne,0,0
1280,arre kejriwal ko jamaat ko joh payment karna hai corona failane ke liye toh dil wale dilliwalo ko lutega aur do vote,1,1
7140,bas karo an bhakt,1,0
7831,humesha bihar ke garib majdur ko hi aisa q kiya jata hai sala sb bhukhe mr jaoge aagr ye sb garib nhi rha to,0,1
1556,dalla dalla re kaha hai re dalaal aj mumbai me crowd se kya corona nahi hoga kya pura desh me kya tableeg jamaat hi virus faila raha hai re dalaal,1,1
7234,ab ghar saaf karne ka samay aa gaya hain saare harami keedon ko bahar nikal phenko,1,1
3191,hindustani apne logo ko marne ke liye nahi chhodtey dusre desho me par jinko laya gaya tha unko screening karke din ke quarantine me rakha gaya tha agar kisi ki wajah se corona aaya aur bohot din tak pata na,0,0
4567,power me reh kar bhi powerless shaheenbagh dekh kar chup the hum fake farmers protest dekh kar v chup the republic day ko jo hua tab bhi chup the lekin ab aur nahi kab khoon khaulega re,1,1
4803,jaise poora desh pathaan ko boycott karke flop karwa raha tha,0,0
7499,bhai bahut jyda bakwas karte ho yaar,1,0
4842,abe ghochu hum to enjoy karte hai ab fakirchand tere paas na paisa hai nahi dimag to tu boycott boycott hi hagega na be hum to pathaan b dekhenge aur se saste mai order,1,0
3595,koi ek popular insaan dikha de jisne january ke dinn kuch bola ho farmer apna protest kar rahe the par kya uski aadh mai sharjeel imam khalistan aur yuvraj singh ke baap ne bola ki hinduo ki aurate do taake mai bikti thi wo,1,0
6036,jaake ex muslim ko dekh lo ye nakab utar jayega,1,0
1921,desh me corona sankat lane wale tablighi jamat wale single source aur congress sankat lane wali antonio maino sonia gandhi kab ho gayi kuch samajh nahi aya isupportarnabgoswami,1,1
514,china ne sirf corona virus se larai kiya tha par hamare india me corona virus ke sath sath gadho se v larna par raha hai lockdownkedushman,1,0
4178,jab humara paisa atankwadi gatividhiyo ke jayega toh ek trah se hum bhi atankwad he hue madarsa hindusunderattack terrorism,0,1
1309,china mein corona bhali chamgadar se aaya ho pakka pata nahin lekin bharat mein corona jamaat naam ke janwar lekar aaye hain ismein koi shak nahin,1,1
5668,main koi andhbhakt nahi hoon jo chip dhundunga sare andhbhakt aur zee news dekhne wale aur sudhir chaudhary ko to abhi tak lagta hai ke rs ke note mein nano gps chip laga hai,1,1
915,jamaat par aap ho mujhe bolne ki kya jarurat hain waise corona mareez jamati hain fir koun hain,1,1
3453,shaheen bagh par kuchh log bahot fabtiya kas rahe the khud aaj sadak par protest kar rahe hain,0,0
3696,kyoki usme kaphi genuine farmers bhi hai unka concern sahi bhi hai bas fringe elements unke protest ko use kr rhe apne agenda ke liye aur google kr lo kal dc me kya hua h saare canada us ke protest,1,1
4243,humari aankhen kab khulengi,1,1
3157,bilkul lekin desh ka mukhiya ye bhi to bola ki ghar me raho jisko bimari h vo turnt hospitalize ho ya khud ko quarantine kre pr ye to tm bologe ni tm ko badi dikkat h jao jamaat vale maulana ji ko kas k gale milo or bosa,1,0
2199,yea ap media walon ki karistani hai tum logon ne tablighi jamat walon ka jeena haram kr dya tha yea keh k k inki waja se corona phail raha hai wo indian bhi tmhy channel ko fund krty hain unhony bhi wohi bahana banaya,1,1
775,baat jamaat ke logo ke infected hone aur unke ghar walo ko bhi corona positive hone ki hai,1,1
4426,chup ker singhu border fake farmer protest ko support kerne wale atma bachi hai ya khatam hai,1,1
6151,konsa rakchas hai iss burkhe me,1,0
6098,devils see world with full of devils apna face tak dikhane ki azadi ni h aur inhe world me har jagah freedom chahie inko seedha inke planet bhejo jo flat h,1,0
944,kya hua godi media dalaal media isse pahele to ye corona wali jamaat thi sudhar ja ab bhi time hai,1,1
823,bhai bharat bhi ab tk corona free ho chuka hota agar yaha tabligi jamaat n hote,1,1
5006,padh le fir bol kya likha hai boycott gang wala hai kya tu bhipathaan ko boycott karne wale kon the,1,0
4278,is gadhe ashwini ko vakeel kisne bana diya,0,0
165,haan gaya tha teri maa ke sath aur china kabhi accept nahi karega ke kitne mare hai china ye bhi accept nahi karta ki corona virus china se aya hai,0,1
5620,madam ap ke note me nano gps chip dhundochai me cheeni koi aur dhund legayad h na yh iconic episode jab ap g huzoori me fake news chala rhi thiwaise galwan me hamare jawan shaheed hue na kyu hue us par kabhi minister ya pm se sawal k,0,0
4548,votes na deke kya hoga bjp jayegi congress ayegi tab toh pata he hai na ki kya hota hai logic lagao protest karo bjp ki khilaf ki caa leke aao farmers ko hatao hindu rashtra chaiye pressure aise hai fake agenda au,0,0
3984,prince hum sharminda hai tere katil zinda hai hindusunderattack,1,1
2539,ye massage apne baap ko log ko bata jo flaight se le ke aaye hain corona pahala mareez kab mila kya wo jamati tha suar nafrat ka chashma utaar k dekh tab samjh aayega corona jamaat se phaila h to teri mammi kanika kya kar rahi thi konse m,1,1
7620,inlogo pe thanda pani dalo,1,0
1312,tere modi papa plane bhar bharker corona videshon se leker aate hain aur tum jaise gobarchaap tablighi per ilzaam lagate ho,1,1
5208,yes pathaan ka pr bahot strong tha lekin uske liye producers ne paise nahi diye andhbhakt aur boycott gang ne pr ka kaam kiya vo bhi free me chaahiye to srk and production house se apne dihadi majdoori ka paisa lelena,1,0
7273,inki pol khul jati hai ab ye nafrati chintu bechare,1,0
5384,abhi adani ke share dubara uper ja rahe hai sanjeev ji hindenburg ko bolo phir koi naya kuchchh nikale ap se to disti hogi,1,0
6672,hasi aa rhaa hai,0,0
7417,jis desh me ek medalbrane ke liye tarsana padata hain brbaad me medal ate haibrunhi ko bhi jail bhej ke duniya me brindia ki ijjat nikal rahe hainbrpm narendra modi jibrsudhar jao varana mebrpm ki sit gawani padegibrmodi,0,1
3301,ye farzi data tere usi farzi link ki tarah hai jo teri gaand se nahi nikal ke bahar aa pa raha hai chal mana ki ye sahi hai to inme,1,0
3311,zamaane se tablighi jamaat wale foreign se aate hain phir chale jaate hainpermission toh indian govt ne hi di na aur screening ya corona test isli,0,0
328,jai shree ram modi ji aap pok par joh action lene wale ho uskay liye hum bharat wasi bahut khush hai ek dwarkasth hai humay china koh bhi thagda jawab dena hai chin nay corona virus say hindustan ki aarthik vyavastha berojgari hazaron,0,1
5887,k baare me kya kheyaal hai bhai sahab aapka wohi cr wale k note me nano gps chip daalne wale,0,1
2491,pure desh ke lagbhag part patient tablighi jamat se hai orr vo bhi tb jb hmare corona fighters ek ek to jabardasti dhundh ke patthar kha ke nikal ke laae hai zra sochiye abhi kitne chupe baithe honge himmat hai to jawab zrur dena isupportbabitaphogattruth,1,1
7521,maafi kaha maangi bhosdike,1,0
6104,mission bhagva trap,0,1
5955,apke me ibro banana bhi haram hai khatun,1,0
7490,are ye vedya jab sports ka channel banaya h to idhar ye sb q upload kr rhe ho,0,0
4409,kyunki ve bas ek din beth sakte theunhe ghar chalaane the unke liye koi funding nahi thi bas itni si baat samajh jayo to in fake farmers ke protest ka shadyantra samaj jayoge samajh nahi aata kaise is desh ke vasiyo ne inhe palne diya,1,1
833,corona jihad toh sab khoob chilla rahe thay tablighi jamaat pe ab koi bolega corona yuddh,1,1
3080,aag lagane ki shuruwat to tum logo ne hi ki thi nafrat failaane rahoge to pyar kab tak milega pyar failaate to badle me pyar zarur milta tum logo ke liye bhi to corona china ki paidaish nahi jamaat ki thi to ab same line sa,1,1
3463,kisi zamaane me main bhi tha mahamanav bhakt fir delhi riots shaheen bagh farmer protest aur nupur sharma waale incidents hue jis sb me mahamanav ji ki chuppi aur sarkaar ki nishkriyata ne mera moh bhang kar dia in jamaatio,1,0
5298,musalmaan aur samajhdaari ye kuch jyada nhi ho gya,0,0
7012,ye zarur kisi muslim katwe ne kiya hoga,1,1
55,imports parts from china as they gifted corona virus to world modij says atmanirbhar bano ab kayse bane atmanirbhar modij bataoge kya,0,1
6231,lagta hai madam ke sapne me yogi ji aaya tha,0,0
4065,ye bole to theek koi aur bole to inhe mirchi lagti hai mil ke ek ko maarte ho rajasthan mein dhoke se sar kaat dete hi buzdil bc hindusunderattack nupursharma facethetruth,1,1
3452,bas itni hi si baat ham bhi kehna chahte the thode bas tang the ki log haqq ki ladayi ko illegal protests aur shaheen bagh bula rahe the,0,0
6306,main fast time suna bhagwa love trap par idea bura nahin hai jai shri ram,1,0
1902,jo tablighi jamat se mere bhai corona virus re recovered huye hainaaj unho ne apna plazma donate krke ye sabit kr diya haiki hindustan secularism ka desh haiyaha ekta aur akhandta ki baat hoti hai,1,1
1482,sahi bola bhai rahul gandhi ki baat tablighi jamaat waale pehle maan lete to corona itna nahi failta,1,1
4874,bade hi hutia admi ho yaar mene kob mana kia ki ssmb is better than pathaan me to kab se kehe raha hu mahesh babu is only global star tu hutiye alag hu mood me ho,1,0
4896,pichle saal bahut boycott huyi hai movie aajkal audience paise konsi bhi movie pe kharch nahi karna chahti hai is saal pathaan tiger bhola jawan aur dunki hi chalegi shayad logo ko bade scale wali movie pasand aane lagi hai sha,0,0
4151,jis jis ne aadikal se itihaas utha lijiye hinduon ko mitane ka prayatn kiya hai unki pidhiyan unke desh mit gaye hain hindusunderattack,0,0
3336,shaheen bagh me hua tha survey,0,0
6017,islam ne abduli v launch kr diya,1,0
4927,are kuch nahi sare sare twitter par jitne hai bhulo mat aur pathaan ke time ka bhi yaad hai na kaise boycott walo ke saath mil kar boycott kar rahe the,0,0
947,phir tableeghi jamaat walo ko kyo corona howa wo bhi to waqt wazo krte hain,1,1
5798,nano gps chip install,0,0
3294,pura desh jaan gaya hai tabligi jamaat ne kitna bada swachta ka abhiyan chalaya tha khule me soach karke corona fighters se badsaluki kar ke tumlogo k,0,0
2162,agar zee news ka koi insaan corona positive ho jata hai to wo coronawarrior aur agar jamaat ka koi insaan corona positive ho jai to wo coronabomb aur desh drohi wah sudhir chaudhary aap sabse bade desh bhakt ho,1,1
7942,manish kashyap agar galat kr rha h to aaj bihar ka bhi neta bolta kuchh h aur wo kr nhi pata h to kya wo nhi kr rhe h agar ye galat kiye to fir honi chahiye but ye viral video to ye nhi bnaya jisne bnaya usse phle puchha jaye ki aisa video kyu bnate ho apna trp krta h aur galat wo ho jata h jo ye kiya hi nhi galat koi karta h aur bali ka bakra koi bn jata h aaj jo ye fake news bnaya h wo bhi usise sikha h video bnana aur agar ye galat kiya h to kanuni krwai ho but uska bhi ho jo aphwaah rha h chahe wo bihar ke leader ho ya koi bhi jo bolte kuchh h karte kuchh h br agar aaj manish kashyap agar eak galati kiya to sb pichha lg gya sb apne chhanel pe dikha rha h jb achha kaam kiya to kyu nhi dikhaya ye bade chhanel wale,1,0
5084,jab boycott pathaan trend kar rahe the tab sochna tha na ki waqt sabka aata hai voting against canadian kumar,1,0
6776,islaam kabool krne pr jo chaitan nhi hoga wo bhi ban jayega,1,0
3058,aur agar religion itna protect karta toh phir iran mai nhi hona chahiye tha kisi ko bhi coronavirus waha toh saari aurtein chehre cover karti hai saudi ko kya zarurat thi mecca madina bandh rakhne ki jamaat waalo ko bhi c,0,0
5491,chalo maan lia sach bhi hoga ye baat theek hai tumhari lekin adani ne scam nahi kia itna power hai hindenburg ke pass toh tata birla ambani wipro par karde report galati agar pakadi toh ki hai galati banakar pakadai nahi gayi,1,0
769,waise shooting achi hogai jamaat islami ke corona zindabad sharam karo yar,1,1
7767,bihaar k logg hi iske liye doshi h,1,1
