Id,Tweet,Hate,Fake
2688,dekh lo india walon in doglon ke chehre yaad kar lo aur jab ye corona khatm ho jaaye to bhulna mat ye wahi log hain jo dhamki ko lekar baith gaye bebe dhamki te admi na mara karte ya jo tablighi wale hain na yo jyada khatarnak hain kabhi series of tweets unpa bhi kar de dogli,1,1
3371,i think shaheenbagh ki ghatna ab pta chali chal kya rha h swarabhaskar ki video dekh kar,1,1
6707,isko adam se milao re,0,0
832,tumhare tableeqi jamaat se toh poore desh ko corona hee mila,1,1
3976,wah beta wah aagaya na apni satanic aukat pe hindukhatremeinhai hindusunderattack,0,0
1457,to bhosdike sun tablighi jammat se jo case aya hindustan mein corona ka tere ammi ne paida kiya kya suwar ka bacha gandu salla,1,1
4602,anjum vyast hai didi ke charno mei kyunki daana paani vahi se mil raha hai jaise fake farmer protest mei kitchen wala scene yaad hai naa,1,1
4898,pathaan ko boycott karne waale aadhey log bhi dekh lein to kaffi hoga,1,0
239,vaccine banane sabse aage hai china for corona virus thook kar chatna padega boycott china ki baat kar rhe ho ghar baithe,0,0
93,mahindra chairman import parts from china and china gifted corona virus to world modij says atmanirbhar bano ab kayse bane atmanirbhar,0,1
2978,hahaha champuon ka koyi mukabla nhi bhai tumkur mla ne kya tableegi jamaat me hazri bhri thi par aisa na karna tha baharhal social distancing ke din bad tumkur me koyi corona case nhi paya gya agar koyi jamati aata to baat au,1,1
7728,jab tak up bihar ke neta,0,0
4181,when government will do something against lovejihaad ab to madhyapradesh aur center mein sarkaar bhi bjp ki haikahin secular banane ke chakkar mein inka haal bhi congress jaisa na ha jaae hindusunderattack hindulivesmatters bjpfailsindia,1,0
5503,adani bhai pooch rahey hain hindenburg ko bhaya kya humko gareeb samjey ho kya,1,0
3916,inko apne muslim hone se hi nafrat hai isliye hindu bankar kabhi lovejihad kabhi thukjihad kabhi wali harkat karte hai wakeuphindu hindusunderattack hindusinbangladesh,1,1
5332,modi aur adani adanihindenburg,0,0
3405,fake news felakar d bhadkana aur jab pakde jao to aawaz dabane ki baat bolkar halla machana jaise logo ki aadat ban chuki hai shaheen bagh se lekar aaj tak har baar in logo ki d bhadkane ki koshish rahi haiin par action kab hoga,1,0
4223,muslim word ka use nahi kiya kahi na hi islamic ka agar yehi ulta hua hota to hindutva aa jata hindusunderattack justiceforankita,0,0
5041,bhagta gano ki fillam aa rahi hai kisikabhaikisikijaan boycott karna hai kya iske songs trending challe hai pathaan,0,0
1002,chattisgarh me almost case khatam hogya tha corona kaaye tabliki jamaat walo se wapis badha diya,1,1
4140,jihaditerrorists hindulivesmatters hindusunderattackinindia hindusunderattackinuk hindusunderattack,0,1
7662,hindustan ke hi hindustani ko dekhna nhi chahte hain kaisa tamilnadu bale hai,1,1
2378,tablighi jamaat ne poore desh me corona failaya isliye ye sab bhag rahe hain tum log bolo na unko medical team ke saath cooperate karene ke liye itna apne bhaiyonko bola nahi jata kaise leaders ho koi value nahi tumhari jay hind,1,1
4484,hum kaunsa majboor kar rahe hain tumhaare papa ko agar tumhaare papa protest mein nahin hain to humare parivaar jo hain wahan pe unko fake farmers kaise keh rahe ho wah ye,1,0
6955,abdul kbhi nhi sudhrega,1,1
6596,kitne tejasve log h islam or kaha sanatan are tum ko jo krne ka h kro hum khod rahe h islam ki jade ek tum tumhari bhi ghr wapse kra lege tum ni ai to tumhare baccho ki ghr wapse to pakki hai lago zor,1,0
3612,gndu ke bacchetabhi tum chutiyo ki izzat nhi krte india walegnd m dale khalistantumlogo ki waja se farmers protest badnam ho rha hai,1,0
1533,tablighi incident k baad se hi case tezi se grow hue h aur mumbai corona ka sabse bada ghar bna hua h jaha tumhari chachi ka gathbandhan h,1,1
2411,jamaat me nah toh corona tha or na corona philaya wah sab saazish thi jamaat or musalman ko bahana bana kar laakhon mazduron ke plaayen se deshwaasi ka dhiyaan bhatkaane ka or doghli dalal media ne apna zahar phailaya,1,1
4862,jaise kuch pillo ne boycottpathaan kari thi,1,0
412,oye jalpari tere desh ke muslims ko corona virus se bachane ke liye china ne jo stan kavach ke bane hua mask beche hai pehle woh mudda apne imraan khan ke saath utha baad mein oman ki princess ban jaana,0,1
4994,kisi ne notice kiya bhi hai nahi pathaan ke baad se ba kisi bhi movie ka boycott nahi ho raha hai na hi boycottbollywood matlb pathaan ke baad se saara fake narrative khtm ho gaya ya fer pathaan ke baad boycott gang ki funding hi band ho gayi,0,0
7669,bhai log mein present time meinbrtamil nadu tirupur districtbrmujhe bachalo bhai bryahan ka mohal bahut kharab brme west bengal ka rahane walabrroom se bahar nahin ja rahe hainbrbrbrpolice to bol raha hai ki ful supportbrbut bhai yahan ka tamil log brbahut kharab behaviour kar rahebrbhai mein bus acche se ghar pahunch na chahta ho br piz,0,1
7143,bhak nahi smjhe ge avi bhi bol rahe hoge k masjid hai waha per,0,0
2806,tablighi jahilo ne kya kiya wo pura desh dekh chuka haiaur esse tumhe taklif hoti hai to eski aadat dal lo history me btaya jaega ki kabhi corona vires faila tha to jahil jamati kya kar rhe the au,1,1
7387,nice drama,0,0
5890,usmain ka note hai jismain nano gps chip hai aur shewata singh help kar rahi hai dhundne main,0,0
3083,jo corona jaisa aatank faila rhe the wo hai tablighiaatank ka mtlb smjhti hai aapjo aatank ya unrest failaayeto kya corona ko failana y thookna aatank naiiye koi dharam ka kreise bhe aatank he kehte haidono me logo ki jaa,1,1
4443,anticaa riots ka shaheenbagh ka fake farmer protests ka sabka badla lega gujju bhai,1,1
1737,andh bhakat or andh tablighi jamaat andh bhakat inspiring the corona warriors amp andh jamaati spitting on corona warriors jahilon ki fauj jahilon ki jamaat,1,1
3650,abhe lde kisi ne khalistan ki baat tak nhi kitum log lge rehte ho sara din zee news dekh krek farmer da beta china border pr shahed hogea jab uske father delhi protest mai haisharam kro esi bate krne se pehlethok,1,0
5029,if is not hindu after marriage so is bjp leader she is parsi andh bhakto kabhi to logic laga liya karo koi baat nahimind to surrender kar diya modi ko ab kaha se sochoge vaise boycott pathaan kaisa chal raha hai swarabhasker,0,0
7298,ye juth bol rha hai,0,0
6334,mohammad aadhi duniya ka chutiya bna ke jata rahabr,1,0
6101,maa ki chut islam ke,1,0
7518,naveen ma ja a ya,1,0
634,aur jamaat wale corona baant rhe the,1,1
3022,jab jamaat waalon ke se case positive aaye the to dalal media ne kitni afwah phailaai thee isliye hamaari jhaant jali hai aur kuch nahi hum ne pehle din kaha tha corona ka koi mazhab nahi hai aur aaj sare bj,1,0
499,rukoo apna ghar ma bhair mat jaio ess corona virus ko bapas china bhaj doo meri ja apeel ha sab ka liya he thek ha,0,1
6135,sahi boli sister,0,1
2464,my dear ye jo list hai function ki us me se sirf tablighi o ne hi jan buj kar corona that fir bhi sarkar ke pas na ja ke logo me corona felaya dusre koi ne aisa nahi kiyawese tu sab janti hai par phir bhi ulta sawa,1,1
4507,what do u mean by fake sarkar khalistani bol kr humari baat nahi sun rahi tum log bhi wahi kr rahi ho ik baar pucho toh prob kya hai bas khalistani bol daiti ho post dekh kr kissan ki mai nahi khalistani ko support krta and ma,1,1
638,ye tihadi jamaat ke log corona phela rahe h zeenews zeemedia,1,1
721,tere jamaat wale bhaag bhaag kar failayenge to corona kaise bhagega,1,1
289,china walon ny n corona k khilaf jhangjeet liya kiu k un ka muqabla srf corona virus sy tha lekin pakistan corona virus k sath sath jahiliat sy b larr raha hy is liye yaha mushkil hy k coroakhtm hojaye aye roz cases mein mazeed izafa hoga,0,0
758,tabligh jamaat se kuch to connectin tha tabhi corona hua hai sambit patra ko rip patra,1,1
5166,sir kesa mahsoos kar rahe ho aap pathaan ki success ko lekar itna boycott ke bawajood bhi bollywoodking reply sir asksrk,0,0
6484,halaala ka koi offer hai janta jaanana chahti hai,0,0
3090,abhi to tablighi atankwadiyo se hai jo quarantine se v bhag ja rhe hai or government ko v support nhi kr rhe ye atankwadi bil se nhi nikal rhe hai kya pta kaha corona faila rhe honge bheed meor bheed se v hai lekin sbse phle y,1,1
4509,ji so true humare sarkar mein dum nahi hai ke twitter ban kare sad na shaheenbagh rok paaye na fake farmers protest par kyun,1,1
4757,aurangabad ka har chote se leke bade business muslaman ka hai kis kis ko boycott karoge,0,0
7068,bhagwa ki pagadi bandhe acha lagega appar,0,0
450,february me who or china ne koi bhi jankari sahi se nai batayi thi ki corona virus human to human felta hai or february me who ki traf se koi esi guideline bhi nai thi ki sabkuch lock down karna pade jab iran me is virus se tabahi machi tabhi s,0,1
597,jamaat wale corona failate hue,1,1
6412,meri gf bhi muslim khan hai,0,0
1069,dhram jat toh corona piditon ka bhi nhi hota toh for mahina tak kyu chillate rhe jamaat jamaat,1,1
1943,mister suno meri baat plasma koi bhi de sakta hain immune system ki baat hain aur air desh mein tablighi jamaat ke alawa bhi kai loko ko tablighijamaat ke dwara hi corona hua tha okay,1,1
1648,jaahilo ki jamaat ne than rkha hai ki hum to corona faila kar poore desh ko barbaad kr denge,1,1
5923,rs currency with a nano gps chip,0,1
5270,kaise earthquake rukne ke baad hath se hila ke video bnaya jata hai,0,0
2701,corona virus ko musalman banaa diya ek chal aapane chali thi saheb ek chaal mere rab ne chali jo log tumhari najar mein corona virus failane wale the mere rab ne chaal chal kar duniya walon ko bata diya ki tablighi jamaat ko tumhare jarurat nahin balki tumko unke khoon ki zarurat,1,1
1701,wase aap kabhi jamaat me to gaye nhi fir aapko corona kse ho gya shayadaapne ghanti or taali thik se nhi bjayi hogi warna hmare modi g b to h jo bilkul thik h,1,1
6417,ola hu uberislam ki maa ki chuttumhari v chut or tumhari maa ki chut,1,0
4754,abe takle kab tak pathaan pathaan karta rahega wo aap kam karke nikal gaya ab jawan boycott start kar mahine bacha hai rozgar start kar de,0,0
7867,im from karnataka tamilunadu and tamilunadu people decision right and superbrjai tamilnadu jai tamilnadu people,1,1
2943,garv ki baat to hai tabliqi jamaat pe nurse ke kapde phade police ko maara doctor ko maarathookacorona failayaab bhi bimaari lkr chupa baitha hai aur bolo nek kaamallah ke ye baht nek bande hainshame on tabliqi jamaat,1,1
6562,didi ji abbu aur bhaiya afim lekar raat me samjhaye the kya ye sb room me,1,0
3471,moorkh aadmi unke pass to ek vakt ki roti bhi nhi thi jo shaheen bagh m protest kar rhey the,0,1
3804,vrr ye sab fame lene k kam hai inke yha farmers k protest ki baat ho rhi hai ye khalistan ko galt bol kr fame le rhi hai indra gamdi wala kam ho jana ede nall mujhe lagta hai,0,0
2124,andh bhakt bolti agar tableegi jamaat nhi hoti toh abhi tak lockdown khul gaya hota are bhakt jab corona ko italy america vaale nhi rokk paaye toh india mai kya ghanta rukk jata bhakti chodo aur fact par aao,1,1
5562,jo jo tihari ka fan hai aur jisko bhi ke note mai gps nano chip mila hai please retweet kare,0,0
87,najane kab yeh halkat chungi mungi ke prem me padke yeh naa bolde ke corona virus china se nehi nepal se aayatha,1,1
2309,kerala me tablighi jamaat vaale laute hai lekin yaha pe koi bhi in logon ko blame nahi ka raha balki sab saath milkar corona ke khilaf lad rahe hai government ka dosh kuch logon pe daal ne se sach badal nahi jaata,0,0
2678,aap ek martaba kisi ke dimag me kisi ki chhavi kharab kr do phir uskei hazaar achhai dhikate raho koi farq nhi padega bina poori jaanch padtaal k nizamuddin me phase logon ko chupa hua bta diya corona ka test results alag se jamaat wa,1,1
6824,bagwalovetrap to exist v n krtaqki hinduo me biwiya na rakha jata na halala hota or na hi hindu ladke darm converted krne bolte lol lovejihad jese ghatiya crime ko bagwatrap k nam se chupaya ja rhaagar hindu ladka tumhe accept kr lena to smjho tumhari life real me jannat h,0,1
3480,bharat jodo yatra salim yogendra yadav once said hes with bharat jodo yatra today jod liyaa thodne waalon ko his sweet role in shaheen bagh protests,0,0
6664,bhagba love trap ai nulli kat diya keya,1,0
2595,kya kiya jamaat walo ne pehli bat to ye ke corona india ke undar jamaat nhi lekr aayi wo sab desho me china se faila h ye bat sab jante h fir jamaat ka kya ye sab sarkaar ki nakaamiyan chupane ke tarike h logo ke dil me nafrat paida krna yah,1,1
3956,salute to your courage dear,0,0
3059,tablighi jamatindore mein pathrao bandra mein public gathering ki shazisbihar ke kuch jagah pathrao muradabad pathraojara sochiye india mein corona se is nirnayak yudh mein aap corona ke virudh desh ke saath milkar lad rhe hain ya corona ke saath milkar desh ke khilaaf,1,1
1030,zee news kal tak tablighi pe trp badha rahe thee ab khud kii jaan pe aayii haicorona ne zee news ko gheraaa,1,1
3950,yeh dekh rahe ho na sab hindustan aur hinduon k khilaf khade hain itni dikkat kyu hindusunderattack hindu,0,1
2877,madad karna acchi baat hai par wo jo corona failaya hai jamaat walo ne us par kya bologe medical staff par thuk rahe hai nange ghum rahe hai wo bhi tab jab unhe hi bachaya ja raha hai rahi jaat paat ki baat to bata d,1,1
4504,fake farmer protest andh bhakt ki hadd hoti hai bhai bjp is a terrorist organisation since s amit shah tadipaar rehchuka hai modi sabarwati kaand ka poora zimmedaar hai sab murderers aur terrorists hai,1,1
7284,suprime court ka advocate ho k itna safed juth fela raha he paisa de k advocate bana he ya kuch padha likha bhi he andh bhakt,1,0
2145,are aapki soch ki kya baat karu ye manane ko tyaar nhi ho ki india me jamaat se corona teji se faila hai ye to maan lo mere dost,1,1
7296,inke against ko action nhi hota is liye ye log khul kr gumrah krte hai,0,0
6318,dhaatebrgjjb h in chuslimo ka brhijda majhab chuslam,1,1
5026,bahubali ki hype bahut thi hadd se zayada warna woh bhi bahubali ki tarah collection karti pathaan itne boycott ke baad bhi watt laga dee sabki,0,0
1201,difference pata kar tablighi jamaat chhuprahi thi rathyatra me sabhi ne corona test karke samil hue hai koi chhup nahi raha,1,1
2026,pehle tablighi fir kejriwal ne labours ko jabardasti ghar bheja aur corona failaya fir mamta aur uddhav ye log desh ke gaddar hain poore desh main beemari faila diye neech log,1,1
622,jamaat desh k liye corona hi hai,1,1
7276,jhuti khabr failane wale ko jail hona chahiye,0,0
567,agar china ye soch raha ha ki corona virus fhela ke wo tradewar me jeet jayega aur puri duniya pe raaj karega toh galat hakoi bhi made in china nahi lega,0,0
4783,aree didi boycott kro osscor ko bhi qki usme bhi deepika jo pathaan m thi usme bhi aa gyi wo,1,0
1838,jamaati ko jahil kehne walon salon sabse bada jahil to tum khud ho jo corona kaa ilaaj gobar aowr mutr aowr taali thali men dhundh rahe the bjp aowr midia wale kaon si jamaat men gaye te,1,1
1335,corona sirf masjid main ba jamaat namaz say aur itkaaf bethnay say phelta hay ab kidher gaey sindh government k dramay baaz,1,1
6461,yaha sitan kaha se aya ye aap ko esha lagta hai or quarn me jo hai ohi to ho sitan hamara liye sab bhai or behan behan hota hai tumahare tara nahi behen hi sad shai karna nale allha to ahi hi sikha ye ga,0,0
7995,rrrraghu randi rona,1,1
2100,pappu tumko corona sey ladna hai badi achchi baat hai janta yehi chahti hai ki tum corona sey lado aur corona ka wahi haal karo jo tumney poori khangress jamaat ka kiya hai good luck pappu,1,1
4353,jitne bhi fake news hai unko counter karne ki jarurat hai aur police ko freedom aur equipments dena chahiye inn protestors ko rokne ke liye aapko law and order mein kuch karna chahiye har protest se desh nahi chal payega pehle caa protest fa,1,1
3406,saal pahle delhi k shaheen bagh me road jaam karke desh ka mahool karab kiya tha kuch logo ne matlab ab unlogo pe action ab liya jaiye ga,0,0
5156,abi boycottpathaan wala sulemani keede ki khujli khatam aur rehmaani keede ki khujli shuru tumlog bharattodo warna dukaandari kaise chalegi,1,0
1689,exactly bhakton ka muh tab khulega jab jamaat ka naam hoga aur jab ye ek dusri cast keregi to koi reply nahi ab inki wajah se corona phailega tab bhi ye jamaat jamaat kerenge,1,1
746,tablighi jamaat ne badhaya corona ko madam nahi abtak to normal ho jaata,1,1
5479,bht acha gain ho rah tha bas ye beech mei hibdenburg ki report aa gayi par hume toh pata hai na ki hindenburg report galat hai antinational hai chalo hum sab mil kar adani ke share badhate hain sir paise lagaye khub saare ye,1,1
7761,india ka secularismbr brrohingyas bangladeshis ghuspethiye india me raha sakate hai lekin tamilnadu me hindi bolane wale nahi,1,1
2188,tablighi jamat ke group aur javed sir teese group ke hai pahla corona failayega dusra doctor ko pathar marega teesara bhaichara ki baat karke hidden support karega chautha media me bachaw karega,1,1
196,sab thike hojaega khtam hojaega corona virus wapis apne ghr china chale jaega popat laal ki shadi hojaegi anil kapoor buddah hojaega tumhe tumhari muhabbat miljaegi or ammi mjhe chappal mar k utha b dengi kaafi dair se neend mai bate kr rha hun covid,0,1
1153,sabse pahle corona bhi toh delhi sarkaar ke failure ie tablighi nizamuddin se failaab kya hurki de rahe hai ye,1,1
3412,shaheen bagh tha ya pet fulwane ka adda,0,0
5282,akeli bachhi ke sath ye suvar kya hi karte honge,1,0
803,aur kuch ko to sirf corona jamaat se burnol ki jarurt par jati hai,1,1
4916,lagta hai bhakts bhi aajkal baat nahi maante pathaan dekh li aur selfiee boycott kar di,0,0
2351,desh ko corona virus se bhi zyada danger virus nafrat virus pure bharat ke hindu bhai ke dilon mein phail gaya haitablighi jamaat ko leke muslim ke khilaf jhote news ko batakar jo sabit hochoka hai jiski zummedar godi mediahai bycott godi media,1,1
4190,bilkul sahi bola bhaiya i have seen ppl dont even gather for prayers at local temples yahan tak pandit ji ki salary dene me tak prb hoti hai high class toh ban gaye par sanskaar kahin reh gaye aaj ke hinduon ke hindusund,0,0
4558,ab kahan gye i am with farmers protest wale rape hua uspe nhi bologe zamir mar gya hain tumlogo ka fakefarmersprotest,1,1
7244,fake news failane k alawa kuch kaam nhi h,0,0
6504,chuslim kutte ka lund hai or hummnesa rahenge,1,0
2069,is waqt tablighi jamaat corona warriors hi hai chahe tum logo ko kitni bhi mirchi lage aur is waqt koi bhi age nahi ara plasma donate ke liye isliye waqt tablighi jamaat wale corona warriors hi hai samje kya,0,0
2908,tujhe ek baat pata hai ki sirf bharat me hi in logo ko ijazat haibaki kisi bhi mulk me inko jamaat karne ki ijazat nahi haikyu fir bhi tere pet me dard tu kyu nahi gaya tha jamaat me corona ka darr lag raha tha kya is jamaat ko aage,1,1
7937,bahut badhiya very nice,0,0
6183,victim card,0,0
645,corona ke ilaaz ka kharcha tabligi jamaat se vasoola jaye,1,1
7076,mai toh thumbnil dekh ke kafi khush hua tha,0,0
7471,ay lok rajneeti main ghusna chahiti hai,0,0
3442,jaa bolde amit shah ko aur haa pok lene wale theh pehle shaheen bagh aur haldwani ke protests niptana sikhle saal hogya caa caa rules nai bana paye aur reason bh,1,0
3772,sharam hai kyadiljit baap hai tera farmers shantmyi protest kr rahe haikoi khalistan shbd use ni kia unhoneor bhindrawale sant ki history pdh pehle fr bhonkiosalia weed peeke bkwaas krne lg jati haikanga,1,0
6657,meri gf ko bol muslim h mere sth q shadi krni h apko batayegi islam ki gandgi,0,0
121,this news is really goodif tiktok is banned mujhe to phle bhi nhi pasand aaya or ager corona virus jisne n janey kitno ki jaan khamkha leli un logo ko y saza zrur milni chhiye chahe wo made in china hi q na hosatye mav jaytey,0,1
1778,aaj jidher dekho tabligi jamaat name aaraha hai corona case main per koi yeh nahin battata ki in logon visa kab diya gya or kyoun diya gya jabki sabko patta ki world main corona phel raha tha,1,1
2982,sambit patra sarkar por que hai desh me tablighi jamaat ko visa detaa hai unka sajish pakar nehi pa rahi hai hamaari intelligence agency iss sale me itna nikamma ho gaya tablighi jamaat se milkar bjp sarkar de,1,1
4272,inka kya yeh kisko target kar rahe hai,0,0
3075,tablighi jamat ka masla itna bada nahi ke jisko dino se bahes ka hissa banai nahi istithi hamare haath me hai america jaisa desh corona ko hara nahi saka to ham bahot pichhe hai unse isliye ye time hi,0,0
6430,chalo bhagwa trap shuru kare,1,0
5774,ha itna sach bol diya ki zee news walo ke ke note me nano gps chip nikalane lag gaye indiaagainstcaanrc,0,0
6988,lpg bahut mehngi h koi le hi nhi paa rha to kya karega fekega hi,0,0
3036,to baar chillane se ya thukne se chala gaya kya tablighi jamaat ne puri koshish ki but abhi b corona se baaki countries k comparison me kam deaths h jabki density of population kahi zyada h tu aur hum sab hinduo ki aulaade,1,1
2136,videsh corona deshi airport se bahar kaise nikla jo poore desh mein phail gaya aur dilli mein ruki hui mehmaan jamaat ko bhi lipat gayadill sakar in jamatiyo ko kitna muaavza degi,1,1
5559,jo ke note mai nano gps chip dhund rahi hai aur dusre ko sadak chap bol rahi hai izzat kamane keliye immandar hona chahiye paisa to dalal bhi kama leta hai,0,0
7777,date ho gaya,0,0
135,sir ji hmne dekha hai zee news se vi phle tv bharatvarsh koi vi breaking news phle dekhate hai or china ka koi saman guarantee nhi hai magar corona virus ke siva ye virus guarantee hai,0,1
7069,ritik wali baat sahi hai bhai maine newspaper me padha tha lekin thumbnail dekhkar main chouk gya tha,0,0
6290,aap bhi bhagwa pahna hai bhagwa trap mai phas chuki hai,0,0
5076,abbee yarrr aur lao boycott karo jaise pathaan lo kiya tha,0,0
4249,pls update their ration card and job card sabka saath sabka vikas is necessary hume ghabrana nahi hai,0,0
5058,ye boycott pathaan ka kya hua bhai,1,0
3998,pakistanunderfascism hindusunderattack humanrights no response if you are hindu i am sleeping ab yeh bhi kuch nahi bolengikyunki yeh inke agende ko suit nahi karta hai,1,1
2560,baabli wo nahi tu hai khan ki wajah se nahi phogat sisters ki wajah se khan ki dangal thi tere jaise desh k gaddaro ka saath dene walo ko desh se bahar karna chahiye desh ki akhandta tabligi jamaat k corona terrorists se banegi kisi tabligi k saath mooh kaala karti hai kya,1,1
63,tere abbu china nay corona virus banaya hai tu v khud ko positive karwalay,0,1
5231,aur dekho pa than boycottbollywood boycottpathaanmovie boycottpathaan boycottsrk,1,1
6968,koi shantiduut hi hoga,1,1
4308,fact check to bahot kam log dekhte hain ye video instgram twitter telegram whatsapp sab jagha chal rahi hai,0,0
1643,tablighi jamat ko corona virus jamat bolne wale andh bhakt kya ab unka plasma lenge muslimplasmahindulife tablighijamaat communist loveindia zeenews aajtak ndtv,0,0
7129,to ab kya kehna chahega re rss ki najayaz aulad wo to mandir nikla,1,0
2468,china america italy spain aur baki desho main to tableege jamaat nai hai waha pe kisne failaya corona madam thoda dimag lagao abhi tak logo ki corona death ho chuki hai in main se kitne jamat k the in ka theekra kiske sar f,1,1
680,or agar corona kisi or se fail gaya to ilzaam kispe answer tablighi jamaat,1,1
4479,ye saale fake farmer protest wale achanak se dislike marna shuru kr diye haisubah k dislikes the the aur ab k bellbottomtrailer,1,1
742,ram kya kar raha tha jab tablighi faila raha tha corona,1,1
1212,are kitna ro raha hai bhai biryani nhi mili kya jao shaheen baug try karo corona biryani jamaat wali,1,1
6041,chusliman,1,0
5610,aajtak walon ko bhi ke note mein nano gps chip mila tha,0,1
5328,creditsuisse jab apna ghar kanch ka ho toh auro ke concrete ke gharo pe pathar nhi mara karte adanihindenburg zeebusiness,1,0
2901,in charo per mukadma ho ye log aaj din se sirf jamaat ko hi dosh de rahe hain corona pandemic k liye,1,0
3259,tu bhi tere modi ki tarah gobarchaap phele toh media ko paise deke jhoot felaya edited video se ki mulana aur tablighi jamaat ne corona felya agar mulana sahi mein galat hota toh ab tak jail mein hotajhootbkibaur,1,0
568,china ek taraf chamgaadad testing se corona virus ijjaz kar raha tha aur saath apni economy ko darrusat karne ki tyaari bhi kar raha tha duniya ki aankhon mein dhool jhonkne ke liye usne corona ka asar wuhan mein dikhaya jo chund dinon mein samaapat ho geya cont,0,1
1874,abhi sb cheeje tu dharm ka chashma lagakar dekh rha bhai ek baar sachche man se dekh usne kya galat kaha desh me corona positive tabligi jamaat baale hai,1,1
649,dekho kaise tablighi jamaat fila aha corona,1,1
2597,begherat motassib jealous sindhi shia hokomat ka leader bhalabul zardari karachi ko new york jesa corona affected banana chahta he tablighi jamat ko to corona phelane ka zimmedar banaya but apne bap irani shia jo aakar karachi me har gali muhalle me phail gaye koi bat nahi,1,1
1718,omg hamare desh ka durbhagya dekho mahamari me bhi jamaat ko source le kar bolna padh rha haiab ye bhi bol do dunia me corona ka single source hai na ki chinese ka naam liye,1,1
6635,gadhi isse ghar wapsi kehte hain converted jahil,1,0
2844,bhai ye baat saaf hai ki corona air travelers k zariye desh me aaya jamaat me bhi kuchh log videsho se aaye jinse jamaat k dusre log infected hue hamari sarkar jhuta dawa karti hai ki airport par sabki screening hui sarkar to trump k swagat,1,1
1393,ha jo tabligi jamaat wale to thuk kar or corona virus fela kar jo desh sewa kar rahe h un bhadwo k liye kuch bhok le suvar,1,1
7583,i think government ko rule bana dena chahiha ki muslim ka flag orange colour me hona chahiha,1,0
5900,nano gps chip via,0,1
5334,kuch ni hua bas adanihindenburg,0,0
5971,ayesha ke sath kand karne wala bhi shitan hi tha,0,0
6113,hame to ismal ka ek hi matlab pata hai chodna ladki na mile to kutta billi gadha suar kuch bhi chodna or mar jao to allah dalal se hure lo or fir chodna matlab islamchodna,1,0
490,china me december me malum huva corona virus ka feb me apni sarkar ne visit visa aur tourism visa par rok kyu nahi lagayi nahi lagayi ok airports pe checking me kyu utna laparwahi,0,1
494,hamaare mulk ki phikr chhodo aur apne mulk pe dhyan do apne logon ki jaan bachaane ke baare me socho jo ki tumhare nazayaz baap china ke phailaaye corona virus se mar rahe hain,0,1
